Date received,Product,Sub-product,Issue,Sub-issue,Consumer complaint narrative,Company public response,Company,State,ZIP code,Tags,Consumer consent provided?,Submitted via,Date sent to company,Company response to consumer,Timely response?,Consumer disputed?,Complaint ID
2019-09-24,Debt collection,I do not know,Attempts to collect debt not owed,Debt is not yours,"transworld systems inc. 
is trying to collect a debt that is not mine, not owed and is inaccurate.",,TRANSWORLD SYSTEMS INC,FL,335XX,,Consent provided,Web,2019-09-24,Closed with explanation,Yes,N/A,3384392
2019-09-19,"Credit reporting, credit repair services, or other personal consumer reports",Credit reporting,Incorrect information on your report,Information belongs to someone else,,Company has responded to the consumer and the CFPB and chooses not to provide a public response,Experian Information Solutions Inc.,PA,15206,,Consent not provided,Web,2019-09-20,Closed with non-monetary relief,Yes,N/A,3379500
2019-10-25,"Credit reporting, credit repair services, or other personal consumer reports",Credit reporting,Incorrect information on your report,Information belongs to someone else,"I would like to request the suppression of the following items from my credit report, which are the result of my falling victim to identity theft. This information does not relate to [ transactions that I have made/accounts that I have opened ], as the attached supporting documentation can attest. As such, it should be blocked from appearing on my credit report pursuant to section 605B of the Fair Credit Reporting Act.",Company has responded to the consumer and the CFPB and chooses not to provide a public response,"TRANSUNION INTERMEDIATE HOLDINGS, INC.",CA,937XX,,Consent provided,Web,2019-10-25,Closed with explanation,Yes,N/A,3417821
2019-11-08,Debt collection,I do not know,Communication tactics,Frequent or repeated calls,"Over the past 2 weeks, I have been receiving excessive amounts of telephone calls from the company listed in this complaint. The calls occur between XXXX XXXX and XXXX XXXX to my cell and at my job. The company does not have the right to harass me at work and I want this to stop. It is extremely distracting to be told 5 times a day that I have a call from this collection agency while at work.",,"Diversified Consultants, Inc.",NC,275XX,,Consent provided,Web,2019-11-08,Closed with explanation,Yes,N/A,3433198
2019-02-08,Vehicle loan or lease,Lease,Problem with a credit reporting company's investigation into an existing problem,Their investigation did not fix an error on your report,,,HYUNDAI CAPITAL AMERICA,FL,33161,,Consent not provided,Web,2019-02-08,Closed with non-monetary relief,Yes,N/A,3146310
2019-06-25,Checking or savings account,Checking account,Managing an account,Fee problem,,,"FIRST CITIZENS BANCSHARES, INC.",WI,53202,,N/A,Referral,2019-06-26,Closed with explanation,Yes,N/A,3286479
2019-10-24,"Credit reporting, credit repair services, or other personal consumer reports",Credit reporting,Incorrect information on your report,Information belongs to someone else,,Company has responded to the consumer and the CFPB and chooses not to provide a public response,"TRANSUNION INTERMEDIATE HOLDINGS, INC.",CA,925XX,,Other,Web,2019-10-24,Closed with explanation,Yes,N/A,3416481
2019-11-20,Credit card or prepaid card,General-purpose credit card or charge card,Closing your account,Company closed your account,,Company has responded to the consumer and the CFPB and chooses not to provide a public response,PENTAGON FEDERAL CREDIT UNION,VA,22304,,N/A,Referral,2019-11-21,Closed with explanation,Yes,N/A,3446074
2019-09-08,"Money transfer, virtual currency, or money service",Domestic (US) money transfer,Fraud or scam,,"I was sold access to an event digitally, of which I have all the screenshots to detail the transactions, transferred the money and was provided with only a fake of a ticket. I have reported this to paypal and it was for the amount of {$21.00} including a {$1.00} fee from paypal. 

This occured on XX/XX/2019, by paypal user who gave two accounts : 1 ) XXXX 2 ) XXXX XXXX",,"Paypal Holdings, Inc",RI,029XX,,Consent provided,Web,2019-09-08,Closed with explanation,Yes,N/A,3366475
2019-03-05,Mortgage,Conventional home mortgage,Trouble during payment process,"","This complaint dates back to last XX/XX/XXXX during a loan modification which was done with XXXX ( Account # XXXX ) my previous loan servicer this was after a 2 month forbearance after Hurricane Irma. They had indicated a shortage to my escrow account in the loan modification documents. I was provided different information every time I spoke on the phone with a XXXX   representative. One would say I had an overage, others would say I had a shortage. The modification documents indicated at {$1900.00} shortage. I called, I emailed and wrote letters, I requested a Escrow review of my account in XXXX and XXXX and was told one would be done. They kept delaying and I finally had to sign the Modification documents on XX/XX/XXXX under duress otherwise the Modification would be withdrawn. No review of my escrow was ever done by XXXX, I discovered what appears to be an error when I reviewed the two Escrow Disclosure statements from XXXX for XXXX and XXXX. The Escrow balance for XX/XX/XXXX shows an actual escrow balance of {$2200.00}, the next statement shows a XXXX actual balance for XXXX, a difference of XXXX when only XXXX should have been withdrawn from this account to pay for the monthly mortgage insurance. I have recently contacted by phone and email to XXXX and they have not responded. 

In XX/XX/XXXX my loan servicing was transferred to Mr Cooper ( Formerly Nationstar Mortgage. ) ( Account # XXXX ). Mr Cooper did do a escrow analysis in XXXX of XXXX. That analysis was completely mishandled and they indicate a shortage of XXXX in my account. Even though my account is currently at a XXXX deficit as of XX/XX/XXXX. Their major errors was their analysis to my Hazard insurance and Morgage insurance. They indicated the Hazard insurance was XXXX last year ( when it was actually XXXX ) and this year the correct amount of XXXX. The Mortgage insurance they again misquoted last year at XXXX ( the actual was XXXX ) and listed this year the correct amount at XXXX so they are showing a difference from last year to this year of XXXX increase. This is totally wrong. They are demanding the difference be paid in a lump sum or have my monthly payment increased to cover the shortage over a year period. I have contacted Mr Cooper by phone on  XX/XX/XXXX and was told someone would look at it but no one from their Escrow will call, just an email. I have also sent a letter stating the error. The new charges will be taking effect in XXXX so something needs to happen quickly. The simple facts are that my Hazard insurance has gone down from XXXX to XXXX. My taxes did go up from XXXX to XXXX, so the net effect of the two is only XXXX. I am already paying one shortage based on XXXX miscalculation and that was to be spread out over 5 years. 
I want both XXXX and Mr Copper to correct the errors made to my escrow account and have XXXX send the deficiency to Mr Cooper post haste. I want Mr Cooper to revise the shortage based on all of this information. 
Contact Information : XXXX : XXXX XXXX XXXX XXXX, NJ XXXX Phone XXXX XXXX XXXX : XXXX XXXX XXXX XXXX. XXXX, Tx. XXXX Phone XXXX",,NATIONSTAR MORTGAGE,FL,339XX,,Consent provided,Web,2019-03-11,Closed with explanation,Yes,N/A,3170293
2020-04-07,Debt collection,Mortgage debt,False statements or representation,Attempted to collect wrong amount,"I received an email from a XXXX XXXX along with a single page attached on XX/XX/XXXX. The email read The final pay off amount for XXXX, XXXX will be {$86000.00} This information is provided by XXXX XXXX on XXXX. It was emailed from XXXX. The subject line read Re : XXXX XXXX XXXX ( Payoff amount for XXXX and insurance info.The insurance info was a single page showing coverage of {$77000.00} on a single story dwelling from a XXXX XXXXXXXX XXXX listing my home address and XXXX XXXX, XXXX XXXX , as registered agent. XXXX XXXX was the insured. I responded to that email disagreeing with the amount and asked for some sort of statement of accounting because XXXX XXXX was asking for more than the {$85000.00} financed and I had made payments for 5 years and 7 months consecutively. She responded with just saying no she was correct. On or around XXXX XXXX, XXXX XXXX XXXX XXXX XXXX Attorney In Fact for a XXXX XXXX mailed me a Notice of substitute trustee sale The notice had a sale date of XXXX XXXX, XXXX A date of XX/XX/XXXX An amount of {$95000.00} Borrower XXXX XXXX XXXX XXXX XXXX Collateral : All of Debtors interest in the real property legal described as : XXXX XXXX XXXX  XXXX XXXX XXXX XXXX  XXXX XXXX according to the map and plat there of recorded in the Deed Anns Plat Records XXXX County , Texas . The Note section is blank. This is dated XX/XX/XXXX and has a file stamp of XX/XX/XXXX in XXXX County Records. XXXX XXXX never lended me any money. I was the only person providing money in the purchase of my home. I was in a TREC   contract with XXXX XXXX for my home. It was already signed by us both for the home {$85000.00} financed for 360 months no balloon payment ; until I received XX/XX/XXXX closing documents showing a balloon payment due XXXX XXXX, payments of {$850.00} every month/ {$600.00} being the house payment and the other being taxes. I am wanting to see the bank statements and escrow accounting for the time period of XX/XX/XXXX thru XXXX, XXXX and the payment records for taxes, and all transfer records. And the proof that XXXX XXXX has showing {$95000.00} going from her hand to mine. I want to see the substitute trustee recorded appointment and I want to see proof of XXXX XXXX identity. I want to see the accounting for the down payment made on the property and proof she owned the property when she sold it to me. 
When I obtained legal representation and stopped the sale date, another debt collection letter came dated XX/XX/XXXX for a sale date of XX/XX/XXXX. This notice contains all the same information as the previous notice except it is listing XXXX XXXX name first above XXXX XXXX XXXX XXXX Attorney in fact at XXXX XXXX XXXX XXXX XXXX in XXXX XXXX , Texas . After firing the first attorney hired after the discovery of {$21000.00} in receipts missing from my receipts of payments to XXXX XXXX a new hired attorney chose to conspire with XXXX XXXX XXXX XXXX and XXXX XXXX and in the printed emails left in my file that were my attorney and XXXX XXXX Attorney planning and executing the sale of my home they had agreed on the figures that XXXX will have the HUD 1 payoff Mr Cooper and XXXX loans paid in full their ( your, XXXX XXXX XXXX XXXX ) further states there is a first and second on this property Mr Cooper total payoff by XXXX XXXX {$47000.00} XXXX XXXX XXXX payoff is {$13000.00} subtotal {$60000.00} BUT again there is language of a loan between XXXX and I in an amount said to be {$78000.00} and Mr. XXXX took the liberty of adding Attorney fees of {$5000.00} making a total of {$83000.00} these documents were emailed back and forth plan discussed of running it through the uncontested docket, signed by a judge, filed in the court records, being fully executed. But I never received any documentation of this sale. I am requesting / demanding the pay off accounting and statements and a copy of the HUD1.

Now I am needing to have the documentation and explanation of how my home was sold, if it wasnt is it fraud on the court? And AGAIN I receive another notice of substitute trustee sale dated XX/XX/XXXX this time the amounts are base amount due as maturity : {$88000.00} / unpaid principle past maturity ( 18 % ) {$34000.00} / subtotal {$120000.00} / Attorney Fees XXXX / Cost {$120.00} / Total due XX/XX/XXXX {$130000.00} It continues to read : please contact XXXX XXXX XXXX XXXX for current payoff instructions at my address above please be advised if this payment is not received by XXXX the mortgagee will exercise the rights under the loan documents and foreclose the loan at public sale, Tuesday, XXXX, XXXX at XXXX. In accordance with the federal and Texas laws regarding fair debt debt collections unless you within thirty days after receipt of this notice, dispute the validity of the debt set forth above or any portionhereof the indebtedness will be assumed to be valid. This notice is signed by XXXX XXXX XXXX XXXX Attorney for XXXX XXXX. Now I want to know how you, XXXX XXXX XXXX or and XXXX XXXX can act as an Attorney in fact and harass me for months, years inducing lawsuits when an attorney in fact is not allowed to handle assets held in trust? How can you impose a debt on me of {$130000.00} and state you will respond to my letter of validation when you did not. Mailing me copies of public record court papers and passed made up accounting graphs from your home computer is not accounting. I want to see the reasoning on how you decided I owed this last mentioned notice and the removal of trustee documents recorded. You stated in this debt collection letter you would reveal the original creaditor upon my request and you did not.I mailed to you by certified letter and I faxed you the same validation letter but you not XXXX XXXX responded until I received again a substitute trustee sale notice this time 2 in the same envelope? dated XX/XX/XXXX And XXXX XXXX, XXXX stating I owe {$130000.00} and contains debt collection language but you are threatening to sell my home ...., you already did once. On XX/XX/XXXX you sold my home to XXXX XXXX for a credit bid of {$88000.00}.? I want all tax certificates and the deed of trust back I want all XXXX XXXX XXXX accounting and I want copies of all the escrow account. I want copies of proof you owned my home when you sold it to me XXXX XXXX, XXXX. 
I demand documented proof that you obtained a legal confessed judgement by me. I demand documentation of the mortgage loan you have repeatedly made demands for payment of and of the investment contract you are holding / have held me liable for that I am not a party that is the Pooling and Servicing Agreement. The Statue of Frauds was made to prevent the very thing you have been doing to me. See UCC at 2-201. You have made me an undisclosed third party to a loan modification ; to a contract I am not a party to. This is why you have never been able to show my payments going to a servicing company you are sending them as cash flow to the investors. You kept using the term mortgage in your debt collection letters but a note is a security as you know, this was undisclosed to me along with a disclaimer that was supposed to be in the credit application under Title 16 16 car 433.2 which says the buyer/seller takes it subject to all defenses and claims that the buyer could assert against any transferee or any buyer who buys it. But you Took it out of the loan application. So there is no holder in due course meaning you take it subject to my claims and defenses I am claiming recoupment under UCC 3-305 under UCC 3-306 I am encoring my proprietary and possession art and property interest in the note and its proceds. Also I am encoring my right to rescind the endorsement on the note. The rider XXXX XXXX made the wrap around deed of trust with modifies the conditions of payment and supplements and governs the promissory note. UCC 3-106 ( D ) it cant be negotiated instrument if it is subject or governed by extraneous documents outside the promissory note and you made it subject to an adjustable rate Ryder and a deed of trust. You can not collect an alleged debt on what you call a mortgage and sell someones property when it is not a note or a negotiable interest. It has a maturity longer than nine months making it a security. I am encoring my right to claim under UCC 3-306 the proceeds, rescuind the negotiation, and am claiming my possessionary and property right in the proceeds in the investment contract. I demand a quick response with my demands met as they are rightfully mine and more than owed to me.",,NATIONSTAR MORTGAGE,TX,782XX,,Consent provided,Web,2020-04-09,Closed with explanation,Yes,N/A,3595729
2019-11-22,"Credit reporting, credit repair services, or other personal consumer reports",Credit reporting,Incorrect information on your report,Personal information incorrect,Today XX/XX/XXXX went online to dispute the incorrect personal information and it says This request can not be processed online,Company has responded to the consumer and the CFPB and chooses not to provide a public response,"TRANSUNION INTERMEDIATE HOLDINGS, INC.",FL,330XX,,Consent provided,Web,2019-11-22,Closed with explanation,Yes,N/A,3446975
2019-09-19,"Credit reporting, credit repair services, or other personal consumer reports",Credit reporting,Incorrect information on your report,Information belongs to someone else,,Company has responded to the consumer and the CFPB and chooses not to provide a public response,"TRANSUNION INTERMEDIATE HOLDINGS, INC.",FL,330XX,,Other,Web,2019-09-19,Closed with explanation,Yes,N/A,3379614
2019-04-17,"Credit reporting, credit repair services, or other personal consumer reports",Credit reporting,Problem with a credit reporting company's investigation into an existing problem,Their investigation did not fix an error on your report,XXXX is reporting incorrectly to Equifax and XXXX an account balance of {$2300.00} on the XXXX partial account number XXXX. ( Please see pages 12 and 13 of the attached credit report ). This account is over 7 years old and therefore should not be on my credit report. This incorrect reporting is harming my credit score and is a Fair Credit Reporting Act ( F.C.R.A. ) violation.,,"EQUIFAX, INC.",NC,285XX,,Consent provided,Web,2019-04-17,Closed with explanation,Yes,N/A,3214857
2019-10-24,"Credit reporting, credit repair services, or other personal consumer reports",Credit reporting,Problem with a credit reporting company's investigation into an existing problem,Their investigation did not fix an error on your report,"Please reverse the late payments reported on the following accounts : XXXX XXXX XXXX XXXX XXXX XXXX XXXX The accounts were never past due, I never made a late payment to this company ever please change this, I have a good relationship with these companies.",Company has responded to the consumer and the CFPB and chooses not to provide a public response,"TRANSUNION INTERMEDIATE HOLDINGS, INC.",NC,276XX,,Consent provided,Web,2019-10-24,Closed with explanation,Yes,N/A,3417374
2018-12-14,"Credit reporting, credit repair services, or other personal consumer reports",Credit reporting,Credit monitoring or identity theft protection services,Billing dispute for services,leased atXX/XX/2018 XXXX truck and said I needed a co borrower so I put a down payment and only got credited for one of the none monhs of payments and I get some thired party sayimg they are collecting payment and requested mulitple times for statments I beleive my identy was used and stolen to credit others and I pad out to much tohave no credit showing in my report please help Thank you,Company has responded to the consumer and the CFPB and chooses not to provide a public response,Experian Information Solutions Inc.,CA,940XX,,Consent provided,Web,2018-12-14,Closed with explanation,Yes,N/A,3100335
2019-01-02,"Credit reporting, credit repair services, or other personal consumer reports",Credit reporting,Problem with a credit reporting company's investigation into an existing problem,Difficulty submitting a dispute or getting information about a dispute over the phone,"XXXX  XXXX XXXX ( XXXX ) did not follow the Office of the Comptroller of the currency regulations ( OCC ). XXXX only stated that the information reported to the credit reporting agencies were accurate. Charging-Off a consumer prematurely without abiding by the OCC rules does not constitute fairness and shows unscrupulous practices. I disagree with the validity of the charge-off. 

I would like to know why weren't the rules of OCC followed and why was my account charged off prematurely. The OCC regulations state that an account can be charged off when any loan has been delinquent for a period of time "" or '' deemed uncollectible. Based on my negotiations with BOA representatives, my debt had been reduced approximately {$6000.00} within an 8 month period. I was making payments when the account was charged-off which is proof the account was collectible.",,"EQUIFAX, INC.",VA,201XX,,Consent provided,Web,2019-01-02,Closed with explanation,Yes,N/A,3115024
2019-06-18,"Payday loan, title loan, or personal loan",Installment loan,Charged fees or interest you didn't expect,,,,Kashia Services,MI,481XX,,Consent not provided,Web,2019-06-18,Closed with explanation,Yes,N/A,3279280
2019-10-28,"Credit reporting, credit repair services, or other personal consumer reports",Credit reporting,Problem with fraud alerts or security freezes,,"ALL THREE CREDIT BUREAUS ARE STILL PUTTING FRAUD ALERTS ON MY CREDIT REPORT WITHOUT MY PERMISSION. 

IT SEEMS XXXX IS THE ONE INITIATING THIS AND THEN TELLING THE OTHER BUREAUS TO FOLLOW THEIR LEAD.

THIS IS ILLEGAL, I HAVE NOT REQUESTED THAT ANY FRAUD ALERT BE PUT ON MY CREDIT FILE.

I CHALLENGE THEM ON THE FCRA SECTION 609 TO REMOVE NEGATIVE REMARKS, STATEMENTS AND CREDIT INQUIRIES THAT WERE SUPPOSED TO BE SOFT PULLS AND NOT HARD PULLS AND THESE BUREAUS TRY TO SLIDE PAST THE LAW AND PUT THESE BOGUS FRAUD ALERTS ON MY FILES TO JUSTIFY THEIR ILLEGAL ACTIVITIES. 

NO NEGATIVE REMARKS SHOULD BE ON ANY OF MY OPEN OR CLOSED ACCOUNTS. NO REMARKS STATING THAT CONSUMER DISAGREES, REINVESTIGATION IN PROGRESS, NOTHING THAT SAYS CONSUMER DISPUTES AS I AM AT THIS TIME NOT DISPUTING ANYTHING AND THESE REMARKS AND THESE FRAUD ALERTS ARE BEING PLACED ON MY FILES WITHOUT MY PERMISSION AND ARE AGAINST THE LAW.",Company has responded to the consumer and the CFPB and chooses not to provide a public response,"TRANSUNION INTERMEDIATE HOLDINGS, INC.",CO,80920,,Consent provided,Web,2019-10-28,Closed with non-monetary relief,Yes,N/A,3420108
2019-11-24,"Credit reporting, credit repair services, or other personal consumer reports",Credit reporting,Incorrect information on your report,Information belongs to someone else,,Company has responded to the consumer and the CFPB and chooses not to provide a public response,"TRANSUNION INTERMEDIATE HOLDINGS, INC.",FL,331XX,,Other,Web,2019-11-24,Closed with explanation,Yes,N/A,3448861
2019-07-01,"Credit reporting, credit repair services, or other personal consumer reports",Credit reporting,Incorrect information on your report,Information belongs to someone else,"This complaint submission is in regards to a false credit report by CREDIT BUREAU ASSOCIATES -NORTHEAST INC ( XXXX XXXX XXXX XXXX XXXX , MA XXXX ). I have made attempts to rectify this matter with them directly as they have now been unresponsive. I spoke with two different representatives one particularly named XXXX XXXX who was extremely rude and stated I am responsible for this debt then hung up the phone. I then spoke with another representative who gave me the fax number so I could forward them a Debt Of Validation letter, which was sent on XX/XX/2019. It was confirmed through my fax machine that the Supervisor had received the files ; however, after 30 days of notifying them, still no response. I specifically asked for proof of debt and anything in signature or judgment by law stating I was obligated to pay them the total of ( {$790.00} ). Prior before sending the letter, the representative stated they have mailed me several notices to my home address. The actual letter came from the alleged original creditor which was sent to a random address I have never been associated with. The original balance on that letter states {$520.00}. CREDIT BUREAU ASSOCIATES -NORTHEAST INC stated I owed them {$790.00} with {$260.00} in collection fees. I have never made any agreement with them nor the original creditor to pay anything nor was I properly notified of this false reported debt. I am requesting CREDIT BUREAU ASSOCIATES -NORTHEAST INC immediately remove me from their systems and update all 3 major Credit Bureaus ( XXXX   , XXXX, & XXXX  ) on this action. At this point they have failed to provide any competent evidence or any legal obligation. CREDIT BUREAU ASSOCIATES -NORTHEAST INC is currently in violation of the Fair Debt Collections Practice Act, 15 USC 1692g, and if this report is not updated immediately I will be taking legal actions.",,"CREDIT BUREAU ASSOCIATES-NORTHEAST, INC.",CA,916XX,,Consent provided,Web,2019-07-01,Closed with explanation,Yes,N/A,3292690
