2020-04-15,Mortgage,FHA mortgage,Struggling to pay mortgage,"","I am in the XXXX  industry and have been deeply affected by the Coronavirus, likely more than most. I am a XXXX XXXX as a XXXX XXXXXXXX and XXXX. I have lost 4 months of work and have even been rescheduling in the Fall and losing my remaining good Saturdays for the year. So I will not be making up that money. I filed for unemployment, but because I am XXXX and work in 2 states ( XXXX XXXX area strattles state line ), I was told I had to call in. The call line sends you to a machine which hangs up on you after directing you back online because they are swamped. So I said I only work in Kansas in order to submit it, but no response or check yet. 

We have XXXX  kids and a new home we bought in XXXX of 2019. Our mortgage company is Mr. Cooper. We have missed 2 payments of roughly {$1800.00} each, XXXX and XXXX, so far. I have tried calling, but they also have an automated message directing you back to online and hanging up afterward. But then I discover the only option is a forbearance, admittedly warning I may be disqualified from any stimulus or other aid if I fill it out. On top of that, they say quite sternly XXXX and repeated bluntly by the CEO in a video ) that it is NOT an extension of the life of the loan, but rather a normal extension, requiring a lump sum at the end of the 90 days. As if anyone is saving money right now and able to pay MORE when this nightmare is over! Thats illogical. It is mentioned that payment plans could be made, but this is not what you agree to in the application and it is so arbitrary it is unknown exactly what they could force you to do after agreeing to this form. This seems unwise to enter into. So for these terms, and the threat of not getting aid, I chose not to fill this out. I did however email them explaining this. I have not heard back and they are still not taking calls. 

We can not lose our home. And we can not pay a higher monthly payment. We are scared and dont know how to fix this. Meanwhile, the days are passing by and notices are flooding in. We have been able to pay all our other bills, but that will end this month if unemployment or a stimulus doesnt come soon. 

If anyone can encourage mortgage companies to extend the life of loans, it would help us immensely. I can only imagine how many people are being hurt by filling out this forbearance, which essentially gives zero aid, and only allows for a little time to then make their account current all at once, without any backpay to do so. It seems dishonest and taking advantage of many people forced to choose this only option. They should be held accountable for making things worse on hurting people everywhere.",,NATIONSTAR MORTGAGE,KS,,,Consent provided,Web,2020-04-15,Closed with explanation,Yes,N/A,3607061
2019-04-11,Credit card or prepaid card,General-purpose credit card or charge card,Problem with a purchase shown on your statement,Card was charged for something you did not purchase with the card,,,AMERICAN EXPRESS COMPANY,NC,27028,,N/A,Referral,2019-04-11,Closed with non-monetary relief,Yes,N/A,3209145
2020-06-29,"Credit reporting, credit repair services, or other personal consumer reports",Credit reporting,Incorrect information on your report,Account status incorrect,,,Experian Information Solutions Inc.,FL,33056,,,Web,2020-06-29,In progress,Yes,N/A,3721791
2019-02-20,Student loan,Private student loan,Dealing with your lender or servicer,Need information about your loan balance or loan terms,"My original lender was XXXX XXXX XXXX ; this loan was considered a private loan that my parents took out to pay for my college education. XXXX XXXX XXXX had switched servicers to XXXX XXXX. The original promissory note I have, shows my father as applicant # 1/borrower, my mother as applicant # 2/co-borrower, and myself as student. This loan originated in XX/XX/XXXX. My father and I share the same name and I feel that has added confusion. My father always made the payments on this loan, as well as, collected tax documents and deductions on this loan, as the borrower. In XX/XX/XXXX, my father passed away from XXXX. My mother contacted XXXX and she was told about loan forgiveness. She submitted my fathers death certificate and she waited 32 days for an answer. Unfortunately, they did not approve the loan for forgiveness. Instead, XXXX has switched me, from student, to borrower and my mother stays as co-borrower. How did I go from being a student on a promissory note, to now the sole borrower? I have called XXXX, and it has been unsuccessful. I have requested documents including the denial letter stating why the loan wasnt forgiven as a result of my father 's death, the promissory note they have on file, as well as the loan terms indicating that I am now legally responsible for this loan. I have had no success in retrieving these documents. I have been told that I am not entitled to these documents from XXXX and to contact XXXX XXXX XXXX for the promissory note. I was told by a XXXX representative that the promissory note they have on file is not legible and she couldnt confirm who was supposed to be borrower/co-borrower. I have contacted XXXX XXXX XXXX, for a copy of the promissory note, by email. I was told by XXXX XXXX XXXX that they do not have the promissory note and to refer to XXXX copy. I have responded to their initial email, requesting more information and they have not responded. There is no contact information for XXXX XXXX XXXX, just an email address. I am doubtful of the information I have been given. I feel I should be entitled to a copy of the denial letter, as well as a legible copy of the promissory note. I would also like to see a copy of the loan terms indicating how I went from being a student, to now the main borrower. I want documentation, and feel it is my consumer right, to have proof that XXXX has that ability to change borrowers and to choose who is made responsible. Though Im hopeful for your timely response and subsequent resolution of my issues, Im fully aware of the 'not-so-positive ' reviews/feedback given to XXXX XXXX and, therefore, will be prepared to submit additional complaints to the XXXX XXXX XXXX , and the Ohio Attorney General.",,"Nelnet, Inc.",OH,,,Consent provided,Web,2019-02-25,Closed with explanation,Yes,N/A,3156880
2019-07-05,Debt collection,Other debt,Written notification about debt,Didn't receive notice of right to dispute,"I worked for XXXX from XX/XX/XXXX to XX/XX/XXXX. XXXX directly paid XXXX for my internet service at my resident. I never received any billing statement from XXXX. Everything was handled directly between XXXX and XXXX. 
I moved and ended my employment with XXXX on XX/XX/XXXX. I received a letter from XXXX XXXX dated XX/XX/XXXX to my new address attempting to collect {$120.00} for XXXX. I called XXXX on XX/XX/XXXX to resolve issue and they confirmed the account was XXXX corporate account. I also called XXXX XXXX to dispute my collection account. I finally received a letter from XXXX XXXX dated XX/XX/XXXX that they had reviewed account and resolved it. The letter stated "" Our office has reviewed the above-referenced account and we have made the decision to discontinue our collection efforts. Rest assured that no information regarding this account has been reported to the credit bureaus by this agency. '' I thought this issue was resolved and closed. 

However, recently, I checked my credit reports on XX/XX/XXXX and I noticed a collection account is on my file. It damaged my credit score and my credit history. I have disputed with all 3 credit agencies. XXXX and XXXX did not resolve my issue. I requested XXXX  3 times : 1 in XXXX, 1 in XXXX, and 1 in XXXX to send me my dispute result in writing but I still haven't received any in mail. XXXX sent me the investigation results. The letter stated that the Collection account from XXXX XXXX XXXX # XXXX. I never receive any letter or any notification from XXXX XXXX XXXX before. This is the first time I am aware of the collection account from XXXX XXXX XXXX for the same creditor XXXX is on my credit file. How many collection agencies out there attempting to collect the same account for XXXX? How can I dispute when I never receive any mail or notification from XXXX XXXX XXXX.? 
Please assist me to resolve this issue and make sure the collection account is removed from my credit file.",Company believes the complaint is the result of a misunderstanding,"CCS Financial Services, Inc.",TX,,,Consent provided,Web,2019-07-05,Closed with explanation,Yes,N/A,3296949
2019-03-28,Debt collection,I do not know,Attempts to collect debt not owed,Debt is not yours,,Company has responded to the consumer and the CFPB and chooses not to provide a public response,Experian Information Solutions Inc.,NY,11236,,Consent not provided,Web,2019-03-28,Closed with explanation,Yes,N/A,3194082
2019-08-01,"Credit reporting, credit repair services, or other personal consumer reports",Credit reporting,Incorrect information on your report,Information belongs to someone else,,Company has responded to the consumer and the CFPB and chooses not to provide a public response,Experian Information Solutions Inc.,OH,44122,,Consent not provided,Web,2019-08-01,Closed with explanation,Yes,N/A,3326647
2019-03-29,Checking or savings account,Other banking product or service,Managing an account,Banking errors,,,"Colony Brands, Inc.",MI,48336,,N/A,Postal mail,2019-04-04,Closed with explanation,Yes,N/A,3195864
2019-07-12,"Credit reporting, credit repair services, or other personal consumer reports",Credit reporting,Incorrect information on your report,Information belongs to someone else,"Yesterday I went to the dealership shopping for a new car. l was approve with an extremely high interest rate so I checked my credit report again to see why my rate was so high. While doing so I noticed a couple of items on my credit report that are not mine. This is unacceptable. I have reached out to the FTC and to my local police department and I am doing this on my own and need these items deleted from my report. XXXX. XXXX XXXX. XXXX, XXXX XXXX. XXXX XXXX. US DEP ED, USDOE/XXXX, XXXX XXXX XXXX XXXX USDOE/XXXX. INQUIRIES : XXXX/XXXX, XXXX",Company has responded to the consumer and the CFPB and chooses not to provide a public response,"TRANSUNION INTERMEDIATE HOLDINGS, INC.",GA,303XX,,Consent provided,Web,2019-07-12,Closed with explanation,Yes,N/A,3304688
2019-02-24,Credit card or prepaid card,General-purpose credit card or charge card,Getting a credit card,Card opened as result of identity theft or fraud,"I have been in USA two times as XXXX student ( summer work and travel program ) .My first trip was from XX/XX/XXXX till XXXX XXXXDuring first trip I opened XXXX XXXX XXXX checking account and close it right before I left a country at XXXX XXXXSecond trip was from XX/XX/XXXX till XXXX XXXX.During second trip I opened a XXXX XXXX checking account and close it right before I left a country at XXXX XXXXFrom XX/XX/XXXX till XX/XX/XXXX I lived in XXXX. When I came into the USA at XX/XX/XXXX I went to XXXX XXXX bank to renew/reopen my checking account. The banking clerk told me that she cant open for me regular account because of my bad credit history, she opened for my opportunity ( limited ) checking account and suggest to check all my information within a credit bureaus. I was shocked because I haver never apply for any credit lines/loans/credit cards in Unites States till XX/XX/XXXX. After a few months I found out information about credit reports/score/credit history. I login to XXXX and XXXX XXXX to check information under my SSN and find out numerous accounts under my name which was opened when I even didnt had a visa to USA. Those accounts were opened within XXXX years when I lived in XXXX and dont even think about USA. So, this complain is about DISCOVER BANK account which was open ( according to XXXX  credit report ) XXXX XXXX, XXXX with a credit limit {$4500.00} and current balance XXXX $ .I have never apply for Discover credit card/never received and never use ANY of Discover Bank credit cards. I physically lived in XXXX-it 's no way for me to used this card. I called Disvover fraud department and told all this information above, but they still didnt report to credit bureaus to remove this fraud account from my credit report.",,DISCOVER BANK,PA,191XX,,Consent provided,Web,2019-02-24,Closed with non-monetary relief,Yes,N/A,3161642
2019-08-29,Debt collection,Other debt,Written notification about debt,Didn't receive enough information to verify debt,"I sent this company several letters asking them to verify this debt or remove it from my account. What they sent me back was just a letter with itemized charges that I allegedly owed. Theres no signed contract with my name or anything. That does not meet the federal trade Commissions guidelines of what constitutes proper debt validation! 
You should also be aware that reporting such invalidated information to major credit bureaus might constitute defamation of character, as the negative marks on my credit report harm my credit and prevent me from enjoying all the benefits of good credit. In addition, the Fair Credit Reporting Act ( FCRA ) does not allow the inaccurate reporting of information on my credit report and under this act.",Company has responded to the consumer and the CFPB and chooses not to provide a public response,"Convergent Resources, Inc.",FL,336XX,,Consent provided,Web,2019-08-29,Closed with explanation,Yes,N/A,3357307
2020-06-26,"Credit reporting, credit repair services, or other personal consumer reports",Credit reporting,Incorrect information on your report,Account status incorrect,,,"EQUIFAX, INC.",CO,,,,Web,2020-06-26,Closed with explanation,Yes,N/A,3717573
2019-02-23,"Credit reporting, credit repair services, or other personal consumer reports",Credit reporting,Incorrect information on your report,Account status incorrect,"In XXXX of 2017 my vehicle was reprocessed after only 30 days of delinquency. However my chief complaint is that I was never notified when the vehicle was auctioned or sold. According to the reprocession laws in the state of Nevada, as the consumer I was supposed to be notified of the date, location of the sale of the vehicle. Also I never received notice of how much the deficiency amount owed if any. This finance company is also reporting inaccuracies on all 3 of my credit reports. XXXX XXXX is reporting every month that I am delinquent which has added extra charges from original balance at the time of charge/off placed on my credit reports. None of the information is accurate that's being reported by XXXX XXXX to all 3 credit agencies. Trans union, XXXX  and XXXX.",Company has responded to the consumer and the CFPB and chooses not to provide a public response,"TRANSUNION INTERMEDIATE HOLDINGS, INC.",NV,890XX,,Consent provided,Web,2019-02-23,Closed with explanation,Yes,N/A,3160943
2019-01-17,"Credit reporting, credit repair services, or other personal consumer reports",Credit reporting,Incorrect information on your report,Information belongs to someone else,"GM Financial is refusing to take off incorrect information from my Credit Report.. back in XX/XX/2017 I went to court for a Car Loan that I was being sued for. I had no idea that I was listed as a co buyer for this Loan until I was served with court papers. I went to court and explained to the judge that the information was not mine and I didn't know of this until I was served the signature didn't belong to me. 
I never agreed to be a co buyer for any Vehicle. 
The Judge dismissed the case against me without prejudice.. I submitted disputes with all Three Credit agencies yet XXXX   has refused to remove it from my report, stating that GM Financial said that the information is correct and therefore can not remove it.. I can't understand why this is possible because XXXX and XXXX has already removed the information from my Credit Report.",,"General Motors Financial Company, Inc.",GA,302XX,,Consent provided,Web,2019-01-17,Closed with explanation,Yes,N/A,3127507
2019-10-24,"Credit reporting, credit repair services, or other personal consumer reports",Credit reporting,Problem with a credit reporting company's investigation into an existing problem,Their investigation did not fix an error on your report,i am a victim of identity theft as previously stated,Company has responded to the consumer and the CFPB and chooses not to provide a public response,"TRANSUNION INTERMEDIATE HOLDINGS, INC.",NY,10035,,Consent provided,Web,2019-10-24,Closed with explanation,Yes,N/A,3415907
2019-04-19,Credit card or prepaid card,Government benefit card,Unexpected or other fees,,,,Comerica,IL,60501,,N/A,Phone,2019-04-19,Closed with explanation,Yes,N/A,3217808
2019-03-21,Debt collection,Federal student loan debt,Written notification about debt,Didn't receive enough information to verify debt,,Company believes it acted appropriately as authorized by contract or law,SLM CORPORATION,IL,60453,,N/A,Referral,2019-03-28,Closed with explanation,Yes,N/A,3186735
2019-08-13,"Credit reporting, credit repair services, or other personal consumer reports",Credit reporting,Incorrect information on your report,Information belongs to someone else,,Company has responded to the consumer and the CFPB and chooses not to provide a public response,"TRANSUNION INTERMEDIATE HOLDINGS, INC.",NY,11003,,Consent not provided,Web,2019-08-13,Closed with non-monetary relief,Yes,N/A,3339641
2019-04-01,"Credit reporting, credit repair services, or other personal consumer reports",Credit reporting,Incorrect information on your report,Information belongs to someone else,,Company has responded to the consumer and the CFPB and chooses not to provide a public response,"TRANSUNION INTERMEDIATE HOLDINGS, INC.",MA,020XX,,Consent not provided,Web,2019-04-01,Closed with explanation,Yes,N/A,3197533
2019-03-29,"Credit reporting, credit repair services, or other personal consumer reports",Credit reporting,Incorrect information on your report,Information belongs to someone else,,Company has responded to the consumer and the CFPB and chooses not to provide a public response,"TRANSUNION INTERMEDIATE HOLDINGS, INC.",PA,19082,,N/A,Fax,2019-03-29,Closed with explanation,Yes,N/A,3195444
2019-02-12,Debt collection,Other debt,False statements or representation,Attempted to collect wrong amount,"Certegy Payment Solutions , LLC is trying to collect a debt I do not owe for a purchase I made through XXXX XXXX. Certegy Payment Solutions , LLC claims to be the owner of the debt. 
-XX/XX/XXXX : Check written to XXXX XXXX for {$8300.00} for a furniture purchase. 
-XX/XX/XXXX : Check was processed by XXXX XXXX XXXX Deposit ( XXXX XXXXXXXX 's Bank ). An encoding error was made by entering the amount erroneously as {$8300.00} ( {$.00} less than the check was written for ). 
-XX/XX/XXXX : Check was processed a second time by a separate entity, XXXX XXXX XXXX ( XXXX XXXX 's Bank ), for the correct amount of {$8300.00}. 
-XX/XX/XXXX : XXXX XXXX ( my bank ) reversed the second transaction since the check was already processed. Letter was sent from XXXX XXXX to me explaining the reversed transaction. Due to XXXX XXXX 's encoding error, they were paid {$.00} less than the check was written for. My Bank ( XXXX XXXX ) can not do anything about the {$.00} variance. XXXX XXXX must initiate the process of collecting the remaining {$.00} through XXXX XXXX 's bank. 

XXXX XXXX sold a debt of {$8300.00} to Certegy Payment Solutions , LLC. Certegy Payment Solutions has been trying to collect this debt since XX/XX/XXXX. Certegy Payment Solutions has also hired a separate debt collector, XXXX XXXX XXXX XXXX XXXX XXXX, who is also sending letters trying to collect this debt. 

In summary, XXXX XXXX sold a debt for an amount that was incorrect in violation of the FDCPA. Certegy Payment Solutions , LLC and XXXX XXXX XXXX XXXX XXXX XXXX are trying to collect a debt I do not owe in violation of the FDCPA. 

I am attaching these letters sent by certified return receipt mail : -XX/XX/XXXX letter to Certegy Payment Solutions , LLC -XX/XX/XXXX letter to XXXX XXXX XXXX XXXX XXXX XXXX XXXX 
-XX/XX/XXXX letter to Certegy Payment Solutions , LLC -XX/XX/XXXX letter to XXXX XXXX XXXX XXXX XXXX XXXX XXXX 
-XX/XX/XXXX letter to Certegy Payment Solutions , LLC I am also attaching 2 additional letters received from Certegy Payment Solutions after my last letter sent XX/XX/XXXX. Based on the content of these 2 letters it is clear Certegy Payment Solutions , LLC has all the documentation to prove I do not owe this debt. They are now crossing a line into harassment.

-JXX/XX/XXXX letter where Certegy Payment Solutions , LLC is now requesting that I prove to them that the check I wrote has cleared my bank twice. This constitutes misleading and unfair debt collection practices since what they are asking for has not happened. The check cleared once, and XXXX XXXX has been paid. If the check cleared my bank twice, I would have paid twice the amount the debt was owed, and therefore XXXX XXXX would owe me {$8300.00}. 
-XX/XX/XXXX letter where Certegy Payment Solutions , LLC is ignoring a letter sent from my financial institution ( XXXX XXXX ) stating the check has been processed through my account. Certegy Payment Solutions , LLC has continually requested contact information for my financial institution, which I have provided. If Certegy Payment Solutions , LLC has an issue with the wording of the letter from XXXX XXXX, they should contact the bank, and confirm that XXXX XXXX has been paid.",Company has responded to the consumer and the CFPB and chooses not to provide a public response,"Certegy Holdings, LLC",MN,,,Consent provided,Web,2019-02-12,Closed with explanation,Yes,N/A,3149735
2019-10-31,"Credit reporting, credit repair services, or other personal consumer reports",Credit reporting,Incorrect information on your report,Account status incorrect,I have contacted XXXX XXXX serveral times and they tell me they do not have my information anymore because it was bought out by XXXX XXXX XXXX  credit card. I paid this amount and it was suppose to be deleted off my credit report. It still shows on my credit report and shows as paid with a zero balance and that the account was charged off and sold to another lender. Neither company will deleted this and update it and both state they can not find my information. This was paid off over two years ago.,,"Healthcare Receivable Professionals, LLC",SC,294XX,,Consent provided,Web,2019-10-31,Closed with explanation,Yes,N/A,3424467
2019-05-25,Debt collection,Credit card debt,Attempts to collect debt not owed,Debt is not yours,,Company has responded to the consumer and the CFPB and chooses not to provide a public response,SYNCHRONY FINANCIAL,IL,62863,,N/A,Postal mail,2019-05-25,Closed with explanation,Yes,N/A,3253862
2019-04-08,Debt collection,Medical debt,Attempts to collect debt not owed,Debt is not yours,,Company believes it acted appropriately as authorized by contract or law,"GOLD KEY CREDIT, INC.",FL,32703,,Consent not provided,Web,2019-04-08,Closed with non-monetary relief,Yes,N/A,3204639
2019-03-28,"Credit reporting, credit repair services, or other personal consumer reports",Credit reporting,Incorrect information on your report,Information belongs to someone else,,Company has responded to the consumer and the CFPB and chooses not to provide a public response,Experian Information Solutions Inc.,TN,38128,,Consent not provided,Web,2019-03-28,Closed with non-monetary relief,Yes,N/A,3194292
